category,title,abstract
q-bio.NC,Response variability in balanced cortical networks,"  We study the spike statistics of neurons in a network with dynamically
balanced excitation and inhibition. Our model, intended to represent a generic
cortical column, comprises randomly connected excitatory and inhibitory leaky
integrate-and-fire neurons, driven by excitatory input from an external
population. The high connectivity permits a mean-field description in which
synaptic currents can be treated as Gaussian noise, the mean and
autocorrelation function of which are calculated self-consistently from the
firing statistics of single model neurons. Within this description, we find
that the irregularity of spike trains is controlled mainly by the strength of
the synapses relative to the difference between the firing threshold and the
post-firing reset level of the membrane potential. For moderately strong
synapses we find spike statistics very similar to those observed in primary
visual cortex.
"
q-bio.NC,Mean field methods for cortical network dynamics,"  We review the use of mean field theory for describing the dynamics of dense,
randomly connected cortical circuits. For a simple network of excitatory and
inhibitory leaky integrate-and-fire neurons, we can show how the firing
irregularity, as measured by the Fano factor, increases with the strength of
the synapses in the network and with the value to which the membrane potential
is reset after a spike. Generalizing the model to include conductance-based
synapses gives insight into the connection between the firing statistics and
the high-conductance state observed experimentally in visual cortex. Finally,
an extension of the model to describe an orientation hypercolumn provides
understanding of how cortical interactions sharpen orientation tuning, in a way
that is consistent with observed firing statistics.
"
q-bio.NC,High conductance states in a mean field cortical network model,"  Measured responses from visual cortical neurons show that spike times tend to
be correlated rather than exactly Poisson distributed. Fano factors vary and
are usually greater than 1 due to the tendency of spikes being clustered into
bursts. We show that this behavior emerges naturally in a balanced cortical
network model with random connectivity and conductance-based synapses. We
employ mean field theory with correctly colored noise to describe temporal
correlations in the neuronal activity. Our results illuminate the connection
between two independent experimental findings: high conductance states of
cortical neurons in their natural environment, and variable non-Poissonian
spike statistics with Fano factors greater than 1.
"
q-bio.NC,Fine Discrimination of Analog Patterns by Nonlinear Dendritic Inhibition,"  Recent experiments revealed that a certain class of inhibitory neurons in the
cerebral cortex make synapses not onto cell bodies but at distal parts of
dendrites of the target neurons, mediating highly nonlinear dendritic
inhibition. We propose a novel form of competitive neural network model that
realizes such dendritic inhibition. Contrary to the conventional lateral
inhibition in neural networks, our dendritic inhibition models don't always
show winner-take-all behaviors; instead, they converge to ""I don't know"" states
when unknown input patterns are presented. We derive reduced two-dimensional
dynamics for the network, showing that a drastic shift of the fixed point from
a winner-take-all state to an ""I don't know"" state occurs in accordance with
the increase in noise added to the stored patterns. By preventing
misrecognition in such a way, dendritic inhibition networks achieve fine
pattern discrimination, which could be one of the basic computations by
inhibitory connected recurrent neural networks in the brain.
"
q-bio.NC,Performance of networks of artificial neurons: The role of clustering,"  The performance of the Hopfield neural network model is numerically studied
on various complex networks, such as the Watts-Strogatz network, the
Barab{\'a}si-Albert network, and the neuronal network of the C. elegans.
Through the use of a systematic way of controlling the clustering coefficient,
with the degree of each neuron kept unchanged, we find that the networks with
the lower clustering exhibit much better performance. The results are discussed
in the practical viewpoint of application, and the biological implications are
also suggested.
"
q-bio.NC,"The perception of melodic consonance: an acoustical and
  neurophysiological explanation based on the overtone series","  The melodic consonance of a sequence of tones is explained using the overtone
series: the overtones form ""flow lines"" that link the tones melodically; the
strength of these flow lines determines the melodic consonance. This hypothesis
admits of psychoacoustical and neurophysiological interpretations that fit well
with the place theory of pitch perception. The hypothesis is used to create a
model for how the auditory system judges melodic consonance, which is used to
algorithmically construct melodic sequences of tones.
"
q-bio.NC,"Mean field theory for a balanced hypercolumn model of orientation
  selectivity in primary visual cortex","  We present a complete mean field theory for a balanced state of a simple
model of an orientation hypercolumn. The theory is complemented by a
description of a numerical procedure for solving the mean-field equations
quantitatively. With our treatment, we can determine self-consistently both the
firing rates and the firing correlations, without being restricted to specific
neuron models. Here, we solve the analytically derived mean-field equations
numerically for integrate-and-fire neurons. Several known key properties of
orientation selective cortical neurons emerge naturally from the description:
Irregular firing with statistics close to -- but not restricted to -- Poisson
statistics; an almost linear gain function (firing frequency as a function of
stimulus contrast) of the neurons within the network; and a contrast-invariant
tuning width of the neuronal firing. We find that the irregularity in firing
depends sensitively on synaptic strengths. If Fano factors are bigger than 1,
then they are so for all stimulus orientations that elicit firing. We also find
that the tuning of the noise in the input current is the same as the tuning of
the external input, while that for the mean input current depends on both the
external input and the intracortical connectivity.
"
q-bio.NC,Pulse-coupled resonate-and-fire models,"  We analyze two pulse-coupled resonate-and-fire neurons. Numerical simulation
reveals that an anti-phase state is an attractor of this model. We can
analytically explain the stability of anti-phase states by means of a return
map of firing times, which we propose in this paper. The resultant stability
condition turns out to be quite simple. The phase diagram based on our theory
shows that there are two types of anti-phase states. One of these cannot be
seen in coupled integrate-and-fire models and is peculiar to resonate-and-fire
models. The results of our theory coincide with those of numerical simulations.
"
q-bio.NC,A toy model of the brain,"  We have designed a toy brain and have written computer code that simulates
it. This toy brain is flexible, modular, has hierarchical learning and
recognition, has short and long term memory, is distributed (i.e. has no
central control), is asynchronous, and includes parallel and series processing.
We have simulated the neurons calculating their internal voltages as a function
of time. We include in the simulation the ion pumps of the neurons, the
synapses with glutamate or GABA neurotransmitters, and the delays of the action
pulses in axons and dendrites. We have used known or plausible circuits of real
brains. The toy brain reads books and learns languages using the Hebb
mechanism. Finally, we have related the toy brain with what might be occurring
in a real brain.
"
q-bio.NC,"General representation of collective neural dynamics with columnar
  modularity","  We exhibit a mathematical framework to represent the neural dynamics at
cortical level. Our description of neural dynamics with columnar and functional
modularity, named fibre bundle representation (FBM) method, is based both on
neuroscience and informatics, whereas they correspond with the conventional
formulas in statistical physics. In spite of complex interactions in neural
circuitry and various cortical modification rules per models, some significant
factors determine the typical phenomena in cortical dynamics. The FBM
representation method reveals them plainly and gives profit in building or
analyzing the cortical dynamic models. Not only the similarity in formulas, the
cortical dynamics can share the statistical properties with other physical
systems, which validated in primary visual maps. We apply our method to
proposed models in visual map formations, in addition our suggestion using the
lateral interaction scheme. In this paper, we will show that the neural dynamic
procedures can be treated through conventional physics expressions and
theories.
"
q-bio.NC,"Cortical Dynamics and Awareness State: An Interpretation of Observed
  Interstimulus Interval Dependence in Apparent Motion","  In a recent paper on Cortical Dynamics, Francis and Grossberg raise the
question how visual forms and motion information are integrated to generate a
coherent percept of moving forms? In their investigation of illusory contours
(which are, like Kanizsa squares, mental constructs rather than stimuli on the
retina) they quantify the subjective impression of apparent motion between
illusory contours that are formed by two subsequent stimuli with delay times of
about 0.2 second (called the interstimulus interval ISI). The impression of
apparent motion is due to a back referral of a later experience to an earlier
time in the conscious representation. A model is developed which describes the
state of awareness in the observer in terms of a time dependent Schroedinger
equation to which a second order time derivative is added. This addition
requires as boundary conditions the values of the solution both at the
beginning and after the process. Satisfactory quantitative agreement is found
between the results of the model and the experimental results. We recall that
in the von Neumann interpretation of the collapse of the quantum mechanical
wave-function, the collapse was associated with an observer's awareness. Some
questions of causality and determinism that arise from later-time boundary
conditions are touched upon.
"
q-bio.NC,"Predicting spike times of a detailed conductance-based neuron model
  driven by stochastic spike arrival","  Reduced models of neuronal activity such as Integrate-and-Fire models allow a
description of neuronal dynamics in simple, intuitive terms and are easy to
simulate numerically. We present a method to fit an Integrate-and-Fire-type
model of neuronal activity, namely a modified version of the Spike Response
Model, to a detailed Hodgkin-Huxley-type neuron model driven by stochastic
spike arrival. In the Hogkin-Huxley model, spike arrival at the synapse is
modeled by a change of synaptic conductance. For such conductance spike input,
more than 70% of the postsynaptic action potentials can be predicted with the
correct timing by the Integrate-and-Fire-type model. The modified Spike
Response Model is based upon a linearized theory of conductance-driven
Integrate-and-Fire neuron.
"
q-bio.NC,"A subjective distance between stimuli: quantifying the metric structure
  of representations","  As subjects perceive the sensory world, different stimuli elicit a number of
neural representations. Here, a subjective distance between stimuli is defined,
measuring the degree of similarity between the underlying representations. As
an example, the subjective distance between different locations in space is
calculated from the activity of rodent hippocampal place cells, and lateral
septal cells. Such a distance is compared to the real distance, between
locations. As the number of sampled neurons increases, the subjective distance
shows a tendency to resemble the metrics of real space.
"
q-bio.NC,How to compute using globally coupled oscillators,"  Synchronization is known to play a vital role within many highly connected
neural systems such as the olfactory systems of fish and insects. In this paper
we show how one can robustly and effectively perform practical computations
using small perturbations to a very simple globally coupled network of coupled
oscillators. Computations are performed by exploiting the spatio-temporal
dynamics of a robust attracting heteroclinic network (also referred to as
`winnerless competition' dynamics). We use different cluster synchronization
states to encode memory states and use this to design a simple multi-base
counter. The simulations indicate that this gives a robust computational system
exploiting the natural dynamics of the system.
"
q-bio.NC,Can Neural Networks Recognize Parts?,"  We have demonstrated neural networks can recognize parts by visual images.
Input signals are gray scale photographs of objects consisting of some parts
and output signals are their shapes. By training neural networks by a few set
of images, without any supervision they become to be able to recognize the
boundary between parts.
"
q-bio.NC,Theory of localized synfire chain,"  Neuron is a noisy information processing unit and conventional view is that
information in the cortex is carried on the rate of neurons spike emission.
More recent studies on the activity propagation through the homogeneous network
have demonstrated that signals can be transmitted with millisecond fidelity;
this model is called the Synfire chain and suggests the possibility of the
spatio-temporal coding. However, the more biologically realistic, structured
feedforward network generates spatially distributed inputs. It results in the
difference of spike timing. This poses a question on how the spatial structure
of a network effect the stability of spatio-temporal spike patterns, and the
speed of a spike packet propagation. By formulating the Fokker-Planck equation
for the feedforwardly coupled network with Mexican-Hat type connectivity, we
show the stability of localized spike packet and existence of Multi-stable
phase where both uniform and localized spike packets are stable depending on
the initial input structure. The Multi-stable phase enables us to show that a
spike pattern, or the information of its own, determines the propagation speed.
"
q-bio.NC,Stimulus competition by inhibitory interference,"  When two stimuli are present in the receptive field of a V4 neuron, the
firing rate response is between the weakest and strongest response elicited by
each of the stimuli alone (Reynolds et al, 1999, Journal of Neuroscience
19:1736-1753). When attention is directed towards the stimulus eliciting the
strongest response (the preferred stimulus), the response to the pair is
increased, whereas the response decreases when attention is directed to the
other stimulus (the poor stimulus). These experimental results were reproduced
in a model of a V4 neuron under the assumption that attention modulates the
activity of local interneuron networks. The V4 model neuron received
stimulus-specific asynchronous excitation from V2 and synchronous inhibitory
inputs from two local interneuron networks in V4. Each interneuron network was
driven by stimulus-specific excitatory inputs from V2 and was modulated by a
projection from the frontal eye fields. Stimulus competition was present
because of a delay in arrival time of synchronous volleys from each interneuron
network. For small delays, the firing rate was close to the rate elicited by
the preferred stimulus alone, whereas for larger delays it approached the
firing rate of the poor stimulus. When either stimulus was presented alone the
neuron's response was not altered by the change in delay. The model suggests
that top-down attention biases the competition between V2 columns for control
of V4 neurons by changing the relative timing of inhibition rather than by
changes in the degree of synchrony of interneuron networks. The mechanism
proposed here for attentional modulation of firing rate - gain modulation by
inhibitory interference - is likely to have more general applicability to
cortical information processing.
"
q-bio.NC,"Effect of Synchronous Incoming Spikes on Activity Pattern in A Network
  of Spiking Neurons","  Although recent neurophysiological experiments suggest that synchronous
neural activity is involved in some perceptual and cognitive processes, the
functional role of such coherent neuronal behavior is not well understood. As a
first step in clarifying this role, we investigate how the temporal coherence
of certain neuronal activity affects the activity pattern in a neural network.
Using a simple network of leaky integrate-and-fire neurons, we study the
effects of synchronized incoming spikes on the functioning of two mechanisms
typically used in model neural systems, winner-take-all competition and
associative memory. We demonstrate that a pair of switches undergone by the
incoming spikes, from asynchronous to synchronous and then back to
asynchronous, triggers a transition of the network from one state to another
state. In the case of associative memory, for example, this switching controls
the timing of the next recalling, whereas the firing rate pattern in the
asynchronous state prepares the network for the next retrieval pattern.
"
q-bio.NC,"Neurokinematic Modeling of Complex Swimming Patterns of the Larval
  Zebrafish","  Larval zebrafish exhibit a variety of complex undulatory swimming patterns.
This repertoire is controlled by the 300 neurons projecting from brain into
spinal cord. Understanding how descending control signals shape the output of
spinal circuits, however, is nontrivial. We have therefore developed a
segmental oscillator model (using NEURON) to investigate this system. We found
that adjusting the strength of NMDA and glycinergic synapses enabled the
generation of oscillation (tail-beat) frequencies over the range exhibited in
different larval swim patterns. In addition, we developed a kinematic model to
visualize the more complex axial bending patterns used during prey capture.
"
q-bio.NC,Activity-dependent brain model explaining EEG spectra,"  Most brain models focus on associative memory or calculation capability,
experimentally inaccessible using physiological methods. Here we present a
model explaining a basic feature of electroencephalograms (EEG). Our model is
based on an electrical network with threshold firing and plasticity of synapses
that reproduces very robustly the measured exponent 0.8 of the medical EEG
spectra, a solid evidence for self-organized criticality. Our result are also
valid on small-world lattices. We propose that an universal scaling behaviour
characterizes many physiological signal spectra for brain controlled
activities.
"
q-bio.NC,"Cognitive styles sex the brain, compete neurally, and quantify deficits
  in autism","  Introduction: Two key dimensions of the mind are understanding and responding
to another's mental state (empathizing), and analysing lawful behaviour
(systemizing).
  Methods: Two questionnaires, the Systemizing Quotient (SQ) and the Empathy
Quotient (EQ), were administered to a normal control group and a group of
individuals with Asperger Syndrome (AS) or High-Functioning Autism (HFA). The
multivariate correlations of the joint scores were analysed using principal
components analysis.
  Results: The principal components were well-approximated by the sums and
differences of the SQ and EQ scores. The differences in the scores corresponded
to sex differences within the control group and also separated out the AS/HFA
group, which showed stronger systemizing than the control group, but
below-average empathy. The sums of the scores did not show sex differences, but
did distinguish the AS/HFA group.
  Conclusions: These tests reliably sex the brain, and their correlations show
that empathizing and systemizing are not independent, but compete neurally.
Their combined score (EQ + SQ) quantifies the deficit in autism spectrum
conditions.
"
q-bio.NC,Computational Models of Adult Neurogenesis,"  Experimental results in recent years have shown that adult neurogenesis is a
significant phenomenon in the mammalian brain. Little is known, however, about
the functional role played by the generation and destruction of neurons in the
context of and adult brain. Here we propose two models where new projection
neurons are incorporated. We show that in both models, using incorporation and
removal of neurons as a computational tool, it is possible to achieve a higher
computational efficiency that in purely static, synapse-learning driven
networks. We also discuss the implication for understanding the role of adult
neurogenesis in specific brain areas.
"
q-bio.NC,"Comment on: ""Characterization of subthreshold voltage fluctuations in
  neuronal membranes"" by M. Rudolph and A. Destexhe","  In two recent papers, Rudolph and Destexhe (Neural Comp. {\bf 15},
  2577-2618, 2003; Neural Comp. in press, 2005) studied a leaky integrator
model (i.e. an RC-circuit) driven by correlated (``colored'') Gaussian
conductance noise and Gaussian current noise. In the first paper they derived
an expression for the stationary probability density of the membrane voltage;
in the second paper this expression was modified to cover a larger parameter
regime. Here we show by standard analysis of solvable limit cases (white-noise
limit of additive and multiplicative noise sources; only slow multiplicative
noise; only additive noise) and by numerical simulations that their first
result does not hold for the general colored-noise case and uncover the errors
made in the derivation of a Fokker-Planck equation for the probability density.
Furthermore, we demonstrate analytically (including an exact integral
expression for the time-dependent mean value of the voltage) and by comparison
to simulation results, that the extended expression for the probability density
works much better but still does not solve exactly the full colored-noise
problem. We also show that at stronger synaptic input the stationary mean value
of the linear voltage model may diverge and give an exact condition relating
the system parameters for which this takes place.
"
q-bio.NC,"Autoassociative Memory Retrieval and Spontaneous Activity Bumps in
  Small-World Networks of Integrate-and-Fire Neurons","  Qualitatively, some real networks in the brain could be characterized as
'small worlds', in the sense that the structure of their connections is
intermediate between the extremes of an orderly geometric arrangement and of a
geometry-independent random mesh. Small worlds can be defined more precisely in
terms of their mean path length and clustering coefficient; but is such a
precise description useful to better understand how the type of connectivity
affects memory retrieval?
  We have simulated an autoassociative memory network of integrate-and-fire
units, positioned on a ring, with the network connectivity varied
parametrically between ordered and random. We find that the network retrieves
when the connectivity is close to random, and displays the characteristic
behavior of ordered nets (localized 'bumps' of activity) when the connectivity
is close to ordered. Recent analytical work shows that these two behaviours can
coexist in a network of simple threshold-linear units, leading to localized
retrieval states. We find that they tend to be mutually exclusive behaviours,
however, with our integrate-and-fire units. Moreover, the transition between
the two occurs for values of the connectivity parameter which are not simply
related to the notion of small worlds.
"
q-bio.NC,"Transient Information Flow in a Network of Excitatory and Inhibitory
  Model Neurons: Role of Noise and Signal Autocorrelation","  We investigate the performance of sparsely-connected networks of
integrate-and-fire neurons for ultra-short term information processing. We
exploit the fact that the population activity of networks with balanced
excitation and inhibition can switch from an oscillatory firing regime to a
state of asynchronous irregular firing or quiescence depending on the rate of
external background spikes.
  We find that in terms of information buffering the network performs best for
a moderate, non-zero, amount of noise. Analogous to the phenomenon of
stochastic resonance the performance decreases for higher and lower noise
levels. The optimal amount of noise corresponds to the transition zone between
a quiescent state and a regime of stochastic dynamics. This provides a
potential explanation on the role of non-oscillatory population activity in a
simplified model of cortical micro-circuits.
"
q-bio.NC,"Signal buffering in random networks of spiking neurons: microscopic vs.
  macroscopic phenomena","  In randomly connected networks of pulse-coupled elements a time-dependent
input signal can be buffered over a short time. We studied the signal buffering
properties in simulated networks as a function of the networks state,
characterized by both the Lyapunov exponent of the microscopic dynamics and the
macroscopic activity derived from mean-field theory. If all network elements
receive the same signal, signal buffering over delays comparable to the
intrinsic time constant of the network elements can be explained by macroscopic
properties and works best at the phase transition to chaos. However, if only 20
percent of the network units receive a common time-dependent signal, signal
buffering properties improve and can no longer be attributed to the macroscopic
dynamics.
"
