category,title,abstract
cs.LG,"Logical settings for concept learning from incomplete examples in First
  Order Logic","  We investigate here concept learning from incomplete examples. Our first
purpose is to discuss to what extent logical learning settings have to be
modified in order to cope with data incompleteness. More precisely we are
interested in extending the learning from interpretations setting introduced by
L. De Raedt that extends to relational representations the classical
propositional (or attribute-value) concept learning from examples framework. We
are inspired here by ideas presented by H. Hirsh in a work extending the
Version space inductive paradigm to incomplete data. H. Hirsh proposes to
slightly modify the notion of solution when dealing with incomplete examples: a
solution has to be a hypothesis compatible with all pieces of information
concerning the examples. We identify two main classes of incompleteness. First,
uncertainty deals with our state of knowledge concerning an example. Second,
generalization (or abstraction) deals with what part of the description of the
example is sufficient for the learning purpose. These two main sources of
incompleteness can be mixed up when only part of the useful information is
known. We discuss a general learning setting, referred to as ""learning from
possibilities"" that formalizes these ideas, then we present a more specific
learning setting, referred to as ""assumption-based learning"" that cope with
examples which uncertainty can be reduced when considering contextual
information outside of the proper description of the examples. Assumption-based
learning is illustrated on a recent work concerning the prediction of a
consensus secondary structure common to a set of RNA sequences.
"
cs.LG,"A Theory of Probabilistic Boosting, Decision Trees and Matryoshki","  We present a theory of boosting probabilistic classifiers. We place ourselves
in the situation of a user who only provides a stopping parameter and a
probabilistic weak learner/classifier and compare three types of boosting
algorithms: probabilistic Adaboost, decision tree, and tree of trees of ... of
trees, which we call matryoshka. ""Nested tree,"" ""embedded tree"" and ""recursive
tree"" are also appropriate names for this algorithm, which is one of our
contributions. Our other contribution is the theoretical analysis of the
algorithms, in which we give training error bounds. This analysis suggests that
the matryoshka leverages probabilistic weak classifiers more efficiently than
simple decision trees.
"
cs.LG,Leading strategies in competitive on-line prediction,"  We start from a simple asymptotic result for the problem of on-line
regression with the quadratic loss function: the class of continuous
limited-memory prediction strategies admits a ""leading prediction strategy"",
which not only asymptotically performs at least as well as any continuous
limited-memory strategy but also satisfies the property that the excess loss of
any continuous limited-memory strategy is determined by how closely it imitates
the leading strategy. More specifically, for any class of prediction strategies
constituting a reproducing kernel Hilbert space we construct a leading
strategy, in the sense that the loss of any prediction strategy whose norm is
not too large is determined by how closely it imitates the leading strategy.
This result is extended to the loss functions given by Bregman divergences and
by strictly proper scoring rules.
"
cs.LG,Competing with Markov prediction strategies,"  Assuming that the loss function is convex in the prediction, we construct a
prediction strategy universal for the class of Markov prediction strategies,
not necessarily continuous. Allowing randomization, we remove the requirement
of convexity.
"
cs.LG,A Study on Learnability for Rigid Lambek Grammars,"  We present basic notions of Gold's ""learnability in the limit"" paradigm,
first presented in 1967, a formalization of the cognitive process by which a
native speaker gets to grasp the underlying grammar of his/her own native
language by being exposed to well formed sentences generated by that grammar.
Then we present Lambek grammars, a formalism issued from categorial grammars
which, although not as expressive as needed for a full formalization of natural
languages, is particularly suited to easily implement a natural interface
between syntax and semantics. In the last part of this work, we present a
learnability result for Rigid Lambek grammars from structured examples.
"
cs.LG,A Massive Local Rules Search Approach to the Classification Problem,"  An approach to the classification problem of machine learning, based on
building local classification rules, is developed. The local rules are
considered as projections of the global classification rules to the event we
want to classify. A massive global optimization algorithm is used for
optimization of quality criterion. The algorithm, which has polynomial
complexity in typical case, is used to find all high--quality local rules. The
other distinctive feature of the algorithm is the integration of attributes
levels selection (for ordered attributes) with rules searching and original
conflicting rules resolution strategy. The algorithm is practical; it was
tested on a number of data sets from UCI repository, and a comparison with the
other predicting techniques is presented.
"
cs.LG,Metric entropy in competitive on-line prediction,"  Competitive on-line prediction (also known as universal prediction of
individual sequences) is a strand of learning theory avoiding making any
stochastic assumptions about the way the observations are generated. The
predictor's goal is to compete with a benchmark class of prediction rules,
which is often a proper Banach function space. Metric entropy provides a
unifying framework for competitive on-line prediction: the numerous known upper
bounds on the metric entropy of various compact sets in function spaces readily
imply bounds on the performance of on-line prediction strategies. This paper
discusses strengths and limitations of the direct approach to competitive
on-line prediction via metric entropy, including comparisons to other
approaches.
"
cs.LG,"PAC Learning Mixtures of Axis-Aligned Gaussians with No Separation
  Assumption","  We propose and analyze a new vantage point for the learning of mixtures of
Gaussians: namely, the PAC-style model of learning probability distributions
introduced by Kearns et al. Here the task is to construct a hypothesis mixture
of Gaussians that is statistically indistinguishable from the actual mixture
generating the data; specifically, the KL-divergence should be at most epsilon.
  In this scenario, we give a poly(n/epsilon)-time algorithm that learns the
class of mixtures of any constant number of axis-aligned Gaussians in
n-dimensional Euclidean space. Our algorithm makes no assumptions about the
separation between the means of the Gaussians, nor does it have any dependence
on the minimum mixing weight. This is in contrast to learning results known in
the ``clustering'' model, where such assumptions are unavoidable.
  Our algorithm relies on the method of moments, and a subalgorithm developed
in previous work by the authors (FOCS 2005) for a discrete mixture-learning
problem.
"
cs.LG,Hedging predictions in machine learning,"  Recent advances in machine learning make it possible to design efficient
prediction algorithms for data sets with huge numbers of parameters. This paper
describes a new technique for ""hedging"" the predictions output by many such
algorithms, including support vector machines, kernel ridge regression, kernel
nearest neighbours, and by many other state-of-the-art methods. The hedged
predictions for the labels of new objects include quantitative measures of
their own accuracy and reliability. These measures are provably valid under the
assumption of randomness, traditional in machine learning: the objects and
their labels are assumed to be generated independently from the same
probability distribution. In particular, it becomes possible to control (up to
statistical fluctuations) the number of erroneous predictions by selecting a
suitable confidence level. Validity being achieved automatically, the remaining
goal of hedged prediction is efficiency: taking full account of the new
objects' features and other available information to produce as accurate
predictions as possible. This can be done successfully using the powerful
machinery of modern machine learning.
"
cs.LG,"A Unified View of TD Algorithms; Introducing Full-Gradient TD and
  Equi-Gradient Descent TD","  This paper addresses the issue of policy evaluation in Markov Decision
Processes, using linear function approximation. It provides a unified view of
algorithms such as TD(lambda), LSTD(lambda), iLSTD, residual-gradient TD. It is
asserted that they all consist in minimizing a gradient function and differ by
the form of this function and their means of minimizing it. Two new schemes are
introduced in that framework: Full-gradient TD which uses a generalization of
the principle introduced in iLSTD, and EGD TD, which reduces the gradient by
successive equi-gradient descents. These three algorithms form a new
intermediate family with the interesting property of making much better use of
the samples than TD while keeping a gradient descent scheme, which is useful
for complexity issues and optimistic policy iteration.
"
cs.LG,Bandit Algorithms for Tree Search,"  Bandit based methods for tree search have recently gained popularity when
applied to huge trees, e.g. in the game of go (Gelly et al., 2006). The UCT
algorithm (Kocsis and Szepesvari, 2006), a tree search method based on Upper
Confidence Bounds (UCB) (Auer et al., 2002), is believed to adapt locally to
the effective smoothness of the tree. However, we show that UCT is too
``optimistic'' in some cases, leading to a regret O(exp(exp(D))) where D is the
depth of the tree. We propose alternative bandit algorithms for tree search.
First, a modification of UCT using a confidence sequence that scales
exponentially with the horizon depth is proven to have a regret O(2^D
\sqrt{n}), but does not adapt to possible smoothness in the tree. We then
analyze Flat-UCB performed on the leaves and provide a finite regret bound with
high probability. Then, we introduce a UCB-based Bandit Algorithm for Smooth
Trees which takes into account actual smoothness of the rewards for performing
efficient ``cuts'' of sub-optimal branches with high confidence. Finally, we
present an incremental tree search version which applies when the full tree is
too big (possibly infinite) to be entirely represented and show that with high
probability, essentially only the optimal branches is indefinitely developed.
We illustrate these methods on a global optimization problem of a Lipschitz
function, given noisy data.
"
cs.LG,Intrinsic dimension of a dataset: what properties does one expect?,"  We propose an axiomatic approach to the concept of an intrinsic dimension of
a dataset, based on a viewpoint of geometry of high-dimensional structures. Our
first axiom postulates that high values of dimension be indicative of the
presence of the curse of dimensionality (in a certain precise mathematical
sense). The second axiom requires the dimension to depend smoothly on a
distance between datasets (so that the dimension of a dataset and that of an
approximating principal manifold would be close to each other). The third axiom
is a normalization condition: the dimension of the Euclidean $n$-sphere $\s^n$
is $\Theta(n)$. We give an example of a dimension function satisfying our
axioms, even though it is in general computationally unfeasible, and discuss a
computationally cheap function satisfying most but not all of our axioms (the
``intrinsic dimensionality'' of Ch\'avez et al.)
"
cs.LG,Parametric Learning and Monte Carlo Optimization,"  This paper uncovers and explores the close relationship between Monte Carlo
Optimization of a parametrized integral (MCO), Parametric machine-Learning
(PL), and `blackbox' or `oracle'-based optimization (BO). We make four
contributions. First, we prove that MCO is mathematically identical to a broad
class of PL problems. This identity potentially provides a new application
domain for all broadly applicable PL techniques: MCO. Second, we introduce
immediate sampling, a new version of the Probability Collectives (PC) algorithm
for blackbox optimization. Immediate sampling transforms the original BO
problem into an MCO problem. Accordingly, by combining these first two
contributions, we can apply all PL techniques to BO. In our third contribution
we validate this way of improving BO by demonstrating that cross-validation and
bagging improve immediate sampling. Finally, conventional MC and MCO procedures
ignore the relationship between the sample point locations and the associated
values of the integrand; only the values of the integrand at those locations
are considered. We demonstrate that one can exploit the sample location
information using PL techniques, for example by forming a fit of the sample
locations to the associated values of the integrand. This provides an
additional way to apply PL techniques to improve MCO.
"
cs.LG,Supervised Feature Selection via Dependence Estimation,"  We introduce a framework for filtering features that employs the
Hilbert-Schmidt Independence Criterion (HSIC) as a measure of dependence
between the features and the labels. The key idea is that good features should
maximise such dependence. Feature selection for various supervised learning
problems (including classification and regression) is unified under this
framework, and the solutions can be approximated using a backward-elimination
algorithm. We demonstrate the usefulness of our method on both artificial and
real world datasets.
"
cs.LG,"HMM Speaker Identification Using Linear and Non-linear Merging
  Techniques","  Speaker identification is a powerful, non-invasive and in-expensive biometric
technique. The recognition accuracy, however, deteriorates when noise levels
affect a specific band of frequency. In this paper, we present a sub-band based
speaker identification that intends to improve the live testing performance.
Each frequency sub-band is processed and classified independently. We also
compare the linear and non-linear merging techniques for the sub-bands
recognizer. Support vector machines and Gaussian Mixture models are the
non-linear merging techniques that are investigated. Results showed that the
sub-band based method used with linear merging techniques enormously improved
the performance of the speaker identification over the performance of wide-band
recognizers when tested live. A live testing improvement of 9.78% was achieved
"
cs.LG,"Scale-sensitive Psi-dimensions: the Capacity Measures for Classifiers
  Taking Values in R^Q","  Bounds on the risk play a crucial role in statistical learning theory. They
usually involve as capacity measure of the model studied the VC dimension or
one of its extensions. In classification, such ""VC dimensions"" exist for models
taking values in {0, 1}, {1,..., Q} and R. We introduce the generalizations
appropriate for the missing case, the one of models with values in R^Q. This
provides us with a new guaranteed risk for M-SVMs which appears superior to the
existing one.
"
cs.LG,Consistency of the group Lasso and multiple kernel learning,"  We consider the least-square regression problem with regularization by a
block 1-norm, i.e., a sum of Euclidean norms over spaces of dimensions larger
than one. This problem, referred to as the group Lasso, extends the usual
regularization by the 1-norm where all spaces have dimension one, where it is
commonly referred to as the Lasso. In this paper, we study the asymptotic model
consistency of the group Lasso. We derive necessary and sufficient conditions
for the consistency of group Lasso under practical assumptions, such as model
misspecification. When the linear predictors and Euclidean norms are replaced
by functions and reproducing kernel Hilbert norms, the problem is usually
referred to as multiple kernel learning and is commonly used for learning from
heterogeneous data sources and for non linear variable selection. Using tools
from functional analysis, and in particular covariance operators, we extend the
consistency results to this infinite dimensional case and also propose an
adaptive scheme to obtain a consistent model estimate, even when the necessary
condition required for the non adaptive scheme is not satisfied.
"
cs.LG,"Cost-minimising strategies for data labelling : optimal stopping and
  active learning","  Supervised learning deals with the inference of a distribution over an output
or label space $\CY$ conditioned on points in an observation space $\CX$, given
a training dataset $D$ of pairs in $\CX \times \CY$. However, in a lot of
applications of interest, acquisition of large amounts of observations is easy,
while the process of generating labels is time-consuming or costly. One way to
deal with this problem is {\em active} learning, where points to be labelled
are selected with the aim of creating a model with better performance than that
of an model trained on an equal number of randomly sampled points. In this
paper, we instead propose to deal with the labelling cost directly: The
learning goal is defined as the minimisation of a cost which is a function of
the expected model performance and the total cost of the labels used. This
allows the development of general strategies and specific algorithms for (a)
optimal stopping, where the expected cost dictates whether label acquisition
should continue (b) empirical evaluation, where the cost is used as a
performance metric for a given combination of inference, stopping and sampling
methods. Though the main focus of the paper is optimal stopping, we also aim to
provide the background for further developments and discussion in the related
field of active learning.
"
cs.LG,Defensive forecasting for optimal prediction with expert advice,"  The method of defensive forecasting is applied to the problem of prediction
with expert advice for binary outcomes. It turns out that defensive forecasting
is not only competitive with the Aggregating Algorithm but also handles the
case of ""second-guessing"" experts, whose advice depends on the learner's
prediction; this paper assumes that the dependence on the learner's prediction
is continuous.
"
cs.LG,Continuous and randomized defensive forecasting: unified view,"  Defensive forecasting is a method of transforming laws of probability (stated
in game-theoretic terms as strategies for Sceptic) into forecasting algorithms.
There are two known varieties of defensive forecasting: ""continuous"", in which
Sceptic's moves are assumed to depend on the forecasts in a (semi)continuous
manner and which produces deterministic forecasts, and ""randomized"", in which
the dependence of Sceptic's moves on the forecasts is arbitrary and
Forecaster's moves are allowed to be randomized. This note shows that the
randomized variety can be obtained from the continuous variety by smearing
Sceptic's moves to make them continuous.
"
cs.LG,Filtering Additive Measurement Noise with Maximum Entropy in the Mean,"  The purpose of this note is to show how the method of maximum entropy in the
mean (MEM) may be used to improve parametric estimation when the measurements
are corrupted by large level of noise. The method is developed in the context
on a concrete example: that of estimation of the parameter in an exponential
distribution. We compare the performance of our method with the bayesian and
maximum likelihood approaches.
"
cs.LG,Prediction with expert advice for the Brier game,"  We show that the Brier game of prediction is mixable and find the optimal
learning rate and substitution function for it. The resulting prediction
algorithm is applied to predict results of football and tennis matches. The
theoretical performance guarantee turns out to be rather tight on these data
sets, especially in the case of the more extensive tennis data.
"
cs.LG,Consistency of trace norm minimization,"  Regularization by the sum of singular values, also referred to as the trace
norm, is a popular technique for estimating low rank rectangular matrices. In
this paper, we extend some of the consistency results of the Lasso to provide
necessary and sufficient conditions for rank consistency of trace norm
minimization with the square loss. We also provide an adaptive version that is
rank consistent even when the necessary condition for the non adaptive version
is not fulfilled.
"
cs.LG,Clustering with Transitive Distance and K-Means Duality,"  Recent spectral clustering methods are a propular and powerful technique for
data clustering. These methods need to solve the eigenproblem whose
computational complexity is $O(n^3)$, where $n$ is the number of data samples.
In this paper, a non-eigenproblem based clustering method is proposed to deal
with the clustering problem. Its performance is comparable to the spectral
clustering algorithms but it is more efficient with computational complexity
$O(n^2)$. We show that with a transitive distance and an observed property,
called K-means duality, our algorithm can be used to handle data sets with
complex cluster shapes, multi-scale clusters, and noise. Moreover, no
parameters except the number of clusters need to be set in our algorithm.
"
cs.LG,Covariance and PCA for Categorical Variables,"  Covariances from categorical variables are defined using a regular simplex
expression for categories. The method follows the variance definition by Gini,
and it gives the covariance as a solution of simultaneous equations. The
calculated results give reasonable values for test data. A method of principal
component analysis (RS-PCA) is also proposed using regular simplex expressions,
which allows easy interpretation of the principal components. The proposed
methods apply to variable selection problem of categorical data USCensus1990
data. The proposed methods give appropriate criterion for the variable
selection problem of categorical
"
cs.LG,On the Relationship between the Posterior and Optimal Similarity,"  For a classification problem described by the joint density $P(\omega,x)$,
models of $P(\omega\eq\omega'|x,x')$ (the ``Bayesian similarity measure'') have
been shown to be an optimal similarity measure for nearest neighbor
classification. This paper analyzes demonstrates several additional properties
of that conditional distribution. The paper first shows that we can
reconstruct, up to class labels, the class posterior distribution $P(\omega|x)$
given $P(\omega\eq\omega'|x,x')$, gives a procedure for recovering the class
labels, and gives an asymptotically Bayes-optimal classification procedure. It
also shows, given such an optimal similarity measure, how to construct a
classifier that outperforms the nearest neighbor classifier and achieves
Bayes-optimal classification rates. The paper then analyzes Bayesian similarity
in a framework where a classifier faces a number of related classification
tasks (multitask learning) and illustrates that reconstruction of the class
posterior distribution is not possible in general. Finally, the paper
identifies a distinct class of classification problems using
$P(\omega\eq\omega'|x,x')$ and shows that using $P(\omega\eq\omega'|x,x')$ to
solve those problems is the Bayes optimal solution.
"
cs.LG,Equations of States in Singular Statistical Estimation,"  Learning machines which have hierarchical structures or hidden variables are
singular statistical models because they are nonidentifiable and their Fisher
information matrices are singular. In singular statistical models, neither the
Bayes a posteriori distribution converges to the normal distribution nor the
maximum likelihood estimator satisfies asymptotic normality. This is the main
reason why it has been difficult to predict their generalization performances
from trained states. In this paper, we study four errors, (1) Bayes
generalization error, (2) Bayes training error, (3) Gibbs generalization error,
and (4) Gibbs training error, and prove that there are mathematical relations
among these errors. The formulas proved in this paper are equations of states
in statistical estimation because they hold for any true distribution, any
parametric model, and any a priori distribution. Also we show that Bayes and
Gibbs generalization errors are estimated by Bayes and Gibbs training errors,
and propose widely applicable information criteria which can be applied to both
regular and singular statistical models.
"
cs.LG,Density estimation in linear time,"  We consider the problem of choosing a density estimate from a set of
distributions F, minimizing the L1-distance to an unknown distribution
(Devroye, Lugosi 2001). Devroye and Lugosi analyze two algorithms for the
problem: Scheffe tournament winner and minimum distance estimate. The Scheffe
tournament estimate requires fewer computations than the minimum distance
estimate, but has strictly weaker guarantees than the latter.
  We focus on the computational aspect of density estimation. We present two
algorithms, both with the same guarantee as the minimum distance estimate. The
first one, a modification of the minimum distance estimate, uses the same
number (quadratic in |F|) of computations as the Scheffe tournament. The second
one, called ``efficient minimum loss-weight estimate,'' uses only a linear
number of computations, assuming that F is preprocessed.
  We also give examples showing that the guarantees of the algorithms cannot be
improved and explore randomized algorithms for density estimation.
"
