category,title,abstract
cs.AI,MUSE CSP: An Extension to the Constraint Satisfaction Problem,"  This paper describes an extension to the constraint satisfaction problem
(CSP) called MUSE CSP (MUltiply SEgmented Constraint Satisfaction Problem).
This extension is especially useful for those problems which segment into
multiple sets of partially shared variables. Such problems arise naturally in
signal processing applications including computer vision, speech processing,
and handwriting recognition. For these applications, it is often difficult to
segment the data in only one way given the low-level information utilized by
the segmentation algorithms. MUSE CSP can be used to compactly represent
several similar instances of the constraint satisfaction problem. If multiple
instances of a CSP have some common variables which have the same domains and
constraints, then they can be combined into a single instance of a MUSE CSP,
reducing the work required to apply the constraints. We introduce the concepts
of MUSE node consistency, MUSE arc consistency, and MUSE path consistency. We
then demonstrate how MUSE CSP can be used to compactly represent lexically
ambiguous sentences and the multiple sentence hypotheses that are often
generated by speech recognition algorithms so that grammar constraints can be
used to provide parses for all syntactically correct sentences. Algorithms for
MUSE arc and path consistency are provided. Finally, we discuss how to create a
MUSE CSP from a set of CSPs which are labeled to indicate when the same
variable is shared by more than a single CSP.
"
cs.AI,Exploiting Causal Independence in Bayesian Network Inference,"  A new method is proposed for exploiting causal independencies in exact
Bayesian network inference. A Bayesian network can be viewed as representing a
factorization of a joint probability into the multiplication of a set of
conditional probabilities. We present a notion of causal independence that
enables one to further factorize the conditional probabilities into a
combination of even smaller factors and consequently obtain a finer-grain
factorization of the joint probability. The new formulation of causal
independence lets us specify the conditional probability of a variable given
its parents in terms of an associative and commutative operator, such as
``or'', ``sum'' or ``max'', on the contribution of each parent. We start with a
simple algorithm VE for Bayesian network inference that, given evidence and a
query variable, uses the factorization to find the posterior distribution of
the query. We show how this algorithm can be extended to exploit causal
independence. Empirical studies, based on the CPCS networks for medical
diagnosis, show that this method is more efficient than previous methods and
allows for inference in larger networks than previous algorithms.
"
cs.AI,"Quantitative Results Comparing Three Intelligent Interfaces for
  Information Capture: A Case Study Adding Name Information into an Electronic
  Personal Organizer","  Efficiently entering information into a computer is key to enjoying the
benefits of computing. This paper describes three intelligent user interfaces:
handwriting recognition, adaptive menus, and predictive fillin. In the context
of adding a personUs name and address to an electronic organizer, tests show
handwriting recognition is slower than typing on an on-screen, soft keyboard,
while adaptive menus and predictive fillin can be twice as fast. This paper
also presents strategies for applying these three interfaces to other
information collection domains.
"
cs.AI,Characterizations of Decomposable Dependency Models,"  Decomposable dependency models possess a number of interesting and useful
properties. This paper presents new characterizations of decomposable models in
terms of independence relationships, which are obtained by adding a single
axiom to the well-known set characterizing dependency models that are
isomorphic to undirected graphs. We also briefly discuss a potential
application of our results to the problem of learning graphical models from
data.
"
cs.AI,Improved Heterogeneous Distance Functions,"  Instance-based learning techniques typically handle continuous and linear
input values well, but often do not handle nominal input attributes
appropriately. The Value Difference Metric (VDM) was designed to find
reasonable distance values between nominal attribute values, but it largely
ignores continuous attributes, requiring discretization to map continuous
values into nominal values. This paper proposes three new heterogeneous
distance functions, called the Heterogeneous Value Difference Metric (HVDM),
the Interpolated Value Difference Metric (IVDM), and the Windowed Value
Difference Metric (WVDM). These new distance functions are designed to handle
applications with nominal attributes, continuous attributes, or both. In
experiments on 48 applications the new distance metrics achieve higher
classification accuracy on average than three previous distance functions on
those datasets that have both nominal and continuous attributes.
"
cs.AI,"SCREEN: Learning a Flat Syntactic and Semantic Spoken Language Analysis
  Using Artificial Neural Networks","  Previous approaches of analyzing spontaneously spoken language often have
been based on encoding syntactic and semantic knowledge manually and
symbolically. While there has been some progress using statistical or
connectionist language models, many current spoken- language systems still use
a relatively brittle, hand-coded symbolic grammar or symbolic semantic
component. In contrast, we describe a so-called screening approach for learning
robust processing of spontaneously spoken language. A screening approach is a
flat analysis which uses shallow sequences of category representations for
analyzing an utterance at various syntactic, semantic and dialog levels. Rather
than using a deeply structured symbolic analysis, we use a flat connectionist
analysis. This screening approach aims at supporting speech and language
processing by using (1) data-driven learning and (2) robustness of
connectionist networks. In order to test this approach, we have developed the
SCREEN system which is based on this new robust, learned and flat analysis. In
this paper, we focus on a detailed description of SCREEN's architecture, the
flat syntactic and semantic analysis, the interaction with a speech recognizer,
and a detailed evaluation analysis of the robustness under the influence of
noisy or incomplete input. The main result of this paper is that flat
representations allow more robust processing of spontaneous spoken language
than deeply structured representations. In particular, we show how the
fault-tolerance and learning capability of connectionist networks can support a
flat analysis for providing more robust spoken-language processing within an
overall hybrid symbolic/connectionist framework.
"
cs.AI,A Uniform Framework for Concept Definitions in Description Logics,"  Most modern formalisms used in Databases and Artificial Intelligence for
describing an application domain are based on the notions of class (or concept)
and relationship among classes. One interesting feature of such formalisms is
the possibility of defining a class, i.e., providing a set of properties that
precisely characterize the instances of the class. Many recent articles point
out that there are several ways of assigning a meaning to a class definition
containing some sort of recursion. In this paper, we argue that, instead of
choosing a single style of semantics, we achieve better results by adopting a
formalism that allows for different semantics to coexist. We demonstrate the
feasibility of our argument, by presenting a knowledge representation
formalism, the description logic muALCQ, with the above characteristics. In
addition to the constructs for conjunction, disjunction, negation, quantifiers,
and qualified number restrictions, muALCQ includes special fixpoint constructs
to express (suitably interpreted) recursive definitions. These constructs
enable the usual frame-based descriptions to be combined with definitions of
recursive data structures such as directed acyclic graphs, lists, streams, etc.
We establish several properties of muALCQ, including the decidability and the
computational complexity of reasoning, by formulating a correspondence with a
particular modal logic of programs called the modal mu-calculus.
"
cs.AI,Lifeworld Analysis,"  We argue that the analysis of agent/environment interactions should be
extended to include the conventions and invariants maintained by agents
throughout their activity. We refer to this thicker notion of environment as a
lifeworld and present a partial set of formal tools for describing structures
of lifeworlds and the ways in which they computationally simplify activity. As
one specific example, we apply the tools to the analysis of the Toast system
and show how versions of the system with very different control structures in
fact implement a common control structure together with different conventions
for encoding task state in the positions or states of objects in the
environment.
"
cs.AI,"Query DAGs: A Practical Paradigm for Implementing Belief-Network
  Inference","  We describe a new paradigm for implementing inference in belief networks,
which consists of two steps: (1) compiling a belief network into an arithmetic
expression called a Query DAG (Q-DAG); and (2) answering queries using a simple
evaluation algorithm. Each node of a Q-DAG represents a numeric operation, a
number, or a symbol for evidence. Each leaf node of a Q-DAG represents the
answer to a network query, that is, the probability of some event of interest.
It appears that Q-DAGs can be generated using any of the standard algorithms
for exact inference in belief networks (we show how they can be generated using
clustering and conditioning algorithms). The time and space complexity of a
Q-DAG generation algorithm is no worse than the time complexity of the
inference algorithm on which it is based. The complexity of a Q-DAG evaluation
algorithm is linear in the size of the Q-DAG, and such inference amounts to a
standard evaluation of the arithmetic expression it represents. The intended
value of Q-DAGs is in reducing the software and hardware resources required to
utilize belief networks in on-line, real-world applications. The proposed
framework also facilitates the development of on-line inference on different
software and hardware platforms due to the simplicity of the Q-DAG evaluation
algorithm. Interestingly enough, Q-DAGs were found to serve other purposes:
simple techniques for reducing Q-DAGs tend to subsume relatively complex
optimization techniques for belief-network inference, such as network-pruning
and computation-caching.
"
cs.AI,"Connectionist Theory Refinement: Genetically Searching the Space of
  Network Topologies","  An algorithm that learns from a set of examples should ideally be able to
exploit the available resources of (a) abundant computing power and (b)
domain-specific knowledge to improve its ability to generalize. Connectionist
theory-refinement systems, which use background knowledge to select a neural
network's topology and initial weights, have proven to be effective at
exploiting domain-specific knowledge; however, most do not exploit available
computing power. This weakness occurs because they lack the ability to refine
the topology of the neural networks they produce, thereby limiting
generalization, especially when given impoverished domain theories. We present
the REGENT algorithm which uses (a) domain-specific knowledge to help create an
initial population of knowledge-based neural networks and (b) genetic operators
of crossover and mutation (specifically designed for knowledge-based networks)
to continually search for better network topologies. Experiments on three
real-world domains indicate that our new algorithm is able to significantly
increase generalization compared to a standard connectionist theory-refinement
system, as well as our previous algorithm for growing knowledge-based networks.
"
cs.AI,Flaw Selection Strategies for Partial-Order Planning,"  Several recent studies have compared the relative efficiency of alternative
flaw selection strategies for partial-order causal link (POCL) planning. We
review this literature, and present new experimental results that generalize
the earlier work and explain some of the discrepancies in it. In particular, we
describe the Least-Cost Flaw Repair (LCFR) strategy developed and analyzed by
Joslin and Pollack (1994), and compare it with other strategies, including
Gerevini and Schubert's (1996) ZLIFO strategy. LCFR and ZLIFO make very
different, and apparently conflicting claims about the most effective way to
reduce search-space size in POCL planning. We resolve this conflict, arguing
that much of the benefit that Gerevini and Schubert ascribe to the LIFO
component of their ZLIFO strategy is better attributed to other causes. We show
that for many problems, a strategy that combines least-cost flaw selection with
the delay of separable threats will be effective in reducing search-space size,
and will do so without excessive computational overhead. Although such a
strategy thus provides a good default, we also show that certain domain
characteristics may reduce its effectiveness.
"
cs.AI,A Complete Classification of Tractability in RCC-5,"  We investigate the computational properties of the spatial algebra RCC-5
which is a restricted version of the RCC framework for spatial reasoning. The
satisfiability problem for RCC-5 is known to be NP-complete but not much is
known about its approximately four billion subclasses. We provide a complete
classification of satisfiability for all these subclasses into polynomial and
NP-complete respectively. In the process, we identify all maximal tractable
subalgebras which are four in total.
"
cs.AI,"A New Look at the Easy-Hard-Easy Pattern of Combinatorial Search
  Difficulty","  The easy-hard-easy pattern in the difficulty of combinatorial search problems
as constraints are added has been explained as due to a competition between the
decrease in number of solutions and increased pruning. We test the generality
of this explanation by examining one of its predictions: if the number of
solutions is held fixed by the choice of problems, then increased pruning
should lead to a monotonic decrease in search cost. Instead, we find the
easy-hard-easy pattern in median search cost even when the number of solutions
is held constant, for some search methods. This generalizes previous
observations of this pattern and shows that the existing theory does not
explain the full range of the peak in search cost. In these cases the pattern
appears to be due to changes in the size of the minimal unsolvable subproblems,
rather than changing numbers of solutions.
"
cs.AI,Eight Maximal Tractable Subclasses of Allen's Algebra with Metric Time,"  This paper combines two important directions of research in temporal
resoning: that of finding maximal tractable subclasses of Allen's interval
algebra, and that of reasoning with metric temporal information. Eight new
maximal tractable subclasses of Allen's interval algebra are presented, some of
them subsuming previously reported tractable algebras. The algebras allow for
metric temporal constraints on interval starting or ending points, using the
recent framework of Horn DLRs. Two of the algebras can express the notion of
sequentiality between intervals, being the first such algebras admitting both
qualitative and metric time.
"
cs.AI,"Defining Relative Likelihood in Partially-Ordered Preferential
  Structures","  Starting with a likelihood or preference order on worlds, we extend it to a
likelihood ordering on sets of worlds in a natural way, and examine the
resulting logic. Lewis earlier considered such a notion of relative likelihood
in the context of studying counterfactuals, but he assumed a total preference
order on worlds. Complications arise when examining partial orders that are not
present for total orders. There are subtleties involving the exact approach to
lifting the order on worlds to an order on sets of worlds. In addition, the
axiomatization of the logic of relative likelihood in the case of partial
orders gives insight into the connection between relative likelihood and
default reasoning.
"
cs.AI,Towards Flexible Teamwork,"  Many AI researchers are today striving to build agent teams for complex,
dynamic multi-agent domains, with intended applications in arenas such as
education, training, entertainment, information integration, and collective
robotics. Unfortunately, uncertainties in these complex, dynamic domains
obstruct coherent teamwork. In particular, team members often encounter
differing, incomplete, and possibly inconsistent views of their environment.
Furthermore, team members can unexpectedly fail in fulfilling responsibilities
or discover unexpected opportunities. Highly flexible coordination and
communication is key in addressing such uncertainties. Simply fitting
individual agents with precomputed coordination plans will not do, for their
inflexibility can cause severe failures in teamwork, and their
domain-specificity hinders reusability. Our central hypothesis is that the key
to such flexibility and reusability is providing agents with general models of
teamwork. Agents exploit such models to autonomously reason about coordination
and communication, providing requisite flexibility. Furthermore, the models
enable reuse across domains, both saving implementation effort and enforcing
consistency. This article presents one general, implemented model of teamwork,
called STEAM. The basic building block of teamwork in STEAM is joint intentions
(Cohen & Levesque, 1991b); teamwork in STEAM is based on agents' building up a
(partial) hierarchy of joint intentions (this hierarchy is seen to parallel
Grosz & Kraus's partial SharedPlans, 1996). Furthermore, in STEAM, team members
monitor the team's and individual members' performance, reorganizing the team
as necessary. Finally, decision-theoretic communication selectivity in STEAM
ensures reduction in communication overheads of teamwork, with appropriate
sensitivity to the environmental conditions. This article describes STEAM's
application in three different complex domains, and presents detailed empirical
results.
"
cs.AI,Identifying Hierarchical Structure in Sequences: A linear-time algorithm,"  SEQUITUR is an algorithm that infers a hierarchical structure from a sequence
of discrete symbols by replacing repeated phrases with a grammatical rule that
generates the phrase, and continuing this process recursively. The result is a
hierarchical representation of the original sequence, which offers insights
into its lexical structure. The algorithm is driven by two constraints that
reduce the size of the grammar, and produce structure as a by-product. SEQUITUR
breaks new ground by operating incrementally. Moreover, the method's simple
structure permits a proof that it operates in space and time that is linear in
the size of the input. Our implementation can process 50,000 symbols per second
and has been applied to an extensive range of real world sequences.
"
cs.AI,"Storing and Indexing Plan Derivations through Explanation-based Analysis
  of Retrieval Failures","  Case-Based Planning (CBP) provides a way of scaling up domain-independent
planning to solve large problems in complex domains. It replaces the detailed
and lengthy search for a solution with the retrieval and adaptation of previous
planning experiences. In general, CBP has been demonstrated to improve
performance over generative (from-scratch) planning. However, the performance
improvements it provides are dependent on adequate judgements as to problem
similarity. In particular, although CBP may substantially reduce planning
effort overall, it is subject to a mis-retrieval problem. The success of CBP
depends on these retrieval errors being relatively rare. This paper describes
the design and implementation of a replay framework for the case-based planner
DERSNLP+EBL. DERSNLP+EBL extends current CBP methodology by incorporating
explanation-based learning techniques that allow it to explain and learn from
the retrieval failures it encounters. These techniques are used to refine
judgements about case similarity in response to feedback when a wrong decision
has been made. The same failure analysis is used in building the case library,
through the addition of repairing cases. Large problems are split and stored as
single goal subproblems. Multi-goal problems are stored only when these smaller
cases fail to be merged into a full solution. An empirical evaluation of this
approach demonstrates the advantage of learning from experienced retrieval
failure.
"
cs.AI,"A Model Approximation Scheme for Planning in Partially Observable
  Stochastic Domains","  Partially observable Markov decision processes (POMDPs) are a natural model
for planning problems where effects of actions are nondeterministic and the
state of the world is not completely observable. It is difficult to solve
POMDPs exactly. This paper proposes a new approximation scheme. The basic idea
is to transform a POMDP into another one where additional information is
provided by an oracle. The oracle informs the planning agent that the current
state of the world is in a certain region. The transformed POMDP is
consequently said to be region observable. It is easier to solve than the
original POMDP. We propose to solve the transformed POMDP and use its optimal
policy to construct an approximate policy for the original POMDP. By
controlling the amount of additional information that the oracle provides, it
is possible to find a proper tradeoff between computational time and
approximation quality. In terms of algorithmic contributions, we study in
details how to exploit region observability in solving the transformed POMDP.
To facilitate the study, we also propose a new exact algorithm for general
POMDPs. The algorithm is conceptually simple and yet is significantly more
efficient than all previous exact algorithms.
"
cs.AI,Dynamic Non-Bayesian Decision Making,"  The model of a non-Bayesian agent who faces a repeated game with incomplete
information against Nature is an appropriate tool for modeling general
agent-environment interactions. In such a model the environment state
(controlled by Nature) may change arbitrarily, and the feedback/reward function
is initially unknown. The agent is not Bayesian, that is he does not form a
prior probability neither on the state selection strategy of Nature, nor on his
reward function. A policy for the agent is a function which assigns an action
to every history of observations and actions. Two basic feedback structures are
considered. In one of them -- the perfect monitoring case -- the agent is able
to observe the previous environment state as part of his feedback, while in the
other -- the imperfect monitoring case -- all that is available to the agent is
the reward obtained. Both of these settings refer to partially observable
processes, where the current environment state is unknown. Our main result
refers to the competitive ratio criterion in the perfect monitoring case. We
prove the existence of an efficient stochastic policy that ensures that the
competitive ratio is obtained at almost all stages with an arbitrarily high
probability, where efficiency is measured in terms of rate of convergence. It
is further shown that such an optimal policy does not exist in the imperfect
monitoring case. Moreover, it is proved that in the perfect monitoring case
there does not exist a deterministic policy that satisfies our long run
optimality criterion. In addition, we discuss the maxmin criterion and prove
that a deterministic efficient optimal strategy does exist in the imperfect
monitoring case under this criterion. Finally we show that our approach to
long-run optimality can be viewed as qualitative, which distinguishes it from
previous work in this area.
"
cs.AI,When Gravity Fails: Local Search Topology,"  Local search algorithms for combinatorial search problems frequently
encounter a sequence of states in which it is impossible to improve the value
of the objective function; moves through these regions, called plateau moves,
dominate the time spent in local search. We analyze and characterize plateaus
for three different classes of randomly generated Boolean Satisfiability
problems. We identify several interesting features of plateaus that impact the
performance of local search algorithms. We show that local minima tend to be
small but occasionally may be very large. We also show that local minima can be
escaped without unsatisfying a large number of clauses, but that systematically
searching for an escape route may be computationally expensive if the local
minimum is large. We show that plateaus with exits, called benches, tend to be
much larger than minima, and that some benches have very few exit states which
local search can use to escape. We show that the solutions (i.e., global
minima) of randomly generated problem instances form clusters, which behave
similarly to local minima. We revisit several enhancements of local search
algorithms and explain their performance in light of our results. Finally we
discuss strategies for creating the next generation of local search algorithms.
"
